{
  "socialHandle": "consequat",
  "socialNetworkProvider": "enim",
  "contactPointType": [
    {
      "id": "in aute nulla",
      "name": "et",
      "optInPriority": null,
      "auditInfo": {
        "isDeleted": null,
        "createdBy": "reprehenderit laborum",
        "updatedBy": "aute occaecat ad non",
        "updatedDate": null,
        "createdDate": null
      }
    }
  ],
  "id": "nulla fugiat elit ut",
  "activeFromDate": "2010-12-26",
  "followersCount": 95668626,
  "forPersonalUse": true,
  "bestTimeToContactStartTime": "00:00:01",
  "profileOccurrenceCount": null,
  "forBusinessUse": null,
  "socialHandleName": "ea sed",
  "party": [
    "dolor consectetur exercitation nostrud"
  ],
  "primaryFlag": null
}
